user_input,output,flag,username,timestamp
jLSJ;SL;,"I'm sorry, I don't understand what you meant. Could you please rephrase your question or statement?",,,2023-04-29 12:45:30.829377
i want some project ideas in AI domain,"Sure, here are some project ideas in AI domain:

1. Image recognition and classification: Develop an AI model that can recognize and classify images, such as identifying different types of flowers or classifying handwritten digits.

2. Sentiment analysis: Build a sentiment analysis model that can determine the emotion expressed in a text, such as positive, negative, or neutral sentiment.

3. Chatbot: Develop a chatbot that can answer user queries, provide recommendations, or help with tasks.

4. Fraud detection: Build an AI system that can identify fraudulent activities or transactions, such as credit card fraud.

5. Speech-to-text: Develop an AI model that can transcribe speech into text, which can be useful in applications such as voice assistants or automatic transcription.

6. Predictive maintenance: Build a model that can predict when a machine or device may require maintenance or repair.

7. Natural language processing (NLP): Develop an AI system that can understand and analyze human language, such as sentiment analysis or language translation.

8. Personalized recommendations: Build an AI model that can provide personalized recommendations to users, such as recommending movies or books that align with their interests.

I hope these ideas help you get started with your project!",,,2023-04-29 12:47:58.243021
,C:\Users\LENOVO\Desktop\chatbot\flagged\output\tmpysee0jnj.json,,,2023-04-29 13:07:37.879191
